{
  "$schema": "https://json-schema.org/draft/2020-12/schema",
  "$id": "https://board-vision.local/schemas/component-spec.schema.json",
  "title": "Board Vision component specification",
  "type": "object",
  "additionalProperties": false,
  "required": ["schema_version", "id", "version", "name", "pins"],
  "properties": {
    "schema_version": { "const": "1.0" },
    "id": { "type": "string", "minLength": 1 },
    "version": { "type": "string", "pattern": "^[0-9]+\\.[0-9]+\\.[0-9]+$" },
    "name": { "type": "object", "additionalProperties": { "type": "string" } },
    "pins": {
      "type": "array",
      "minItems": 1,
      "items": {
        "type": "object",
        "additionalProperties": false,
        "required": ["id", "role", "direction", "required"],
        "properties": {
          "id": { "type": "string", "minLength": 1 },
          "role": { "type": "string", "minLength": 1 },
          "direction": { "enum": ["input", "output", "bidirectional", "power"] },
          "required": { "type": "boolean" },
          "voltage": { "type": ["number", "null"] },
          "signal_voltage": { "type": ["number", "null"] },
          "required_capabilities": { "type": "array", "items": { "type": "string" } },
          "required_board_role": { "type": ["string", "null"] },
          "required_rail": { "type": ["string", "null"] }
        }
      }
    }
  }
}
